country,company,wiki_url,official_sites,possible_official_sites,status_note,company_summary,founded_year,headquarters,products,employees,revenue
Singapore,Yeo Hiap Seng,https://en.wikipedia.org/wiki/Yeo_Hiap_Seng,http://www.yeos.com.sg,,Confirmed,"Yeo Hiap Seng Limited (simplified Chinese: 杨协成; traditional Chinese: 楊協成; pinyin: Yáng Xiéchéng; Pe̍h-ōe-jī: Iûⁿ Hia̍p-sêng, Commonly known as Yeo's) is a Singaporean beverage company. It operates as an investment holding company as well as a drink manufacturer in Singapore, Malaysia and China. It i...",1900.0,Singapore,"Food and beverage, property",,SG$ 321.868 Million ( Fiscal Year Ended 31 December 2020 )
Singapore,Wilmar International,https://en.wikipedia.org/wiki/Wilmar_International,,,Manual Check Required,"Wilmar International Limited (simplified Chinese: 丰益国际; traditional Chinese: 豐益國際; Pe̍h-ōe-jī: Hong-ek Kok-chè) is a Singaporean food processing and investment holding company with more than 300 subsidiary companies.: 18 Founded in 1991, it is one of Asia's leading agribusiness groups alongside the ...",1991.0,,"Palm oil, protein meal, consumer pack, edible oils, , sugar, specialty fats, oleochemicals and, biodiesel","about 100,000 (2020)",US$73.40 billion (2022)
South Korea,Binggrae,https://en.wikipedia.org/wiki/Binggrae,https://www.binggrae.com,,Confirmed,"Binggrae Co., Ltd. (Korean: 빙그레; lit. 'smile'), is a South Korean multinational food and beverage corporation that manufactures ice cream, milk products, and snacks. Binggrae was founded in 1967 by Hong Soon-ji as Daeil Corporation (Korean: 대일양행; Hanja: 對日洋行). The B in the Binggrae Logo is modeled a...",1967.0,"Jung-gu (Jeong-dong 34-5, Baejaejeong-dong Building), Seoul, South Korea",,"4,981  (2024)","₩ 1,147,435,000,000 $ 913,094,005.72"
South Korea,CJ GroupCJ CheilJedang,https://en.wikipedia.org/wiki/CJ_Group,https://english.cj.net/index.asp,,Confirmed,"CJ Corporation (Korean: CJ 주식회사), doing business as CJ Group (Korean: CJ그룹) or simply CJ, is a South Korean conglomerate holding company, operating internationally. It is one of the largest chaebol headquartered in Seoul, South Korea. It comprises numerous businesses in various industries of Food & ...",1953.0,"Sowol-ro 2-gil, Jung-gu, Seoul, (THE CENTER)",,,
South Korea,Crown Confectionery,https://en.wikipedia.org/wiki/Crown_Confectionery,,http://www.crown.co.kr/,Potential,"Crown Confectionery (Korean: 크라운제과, KRX: 264900) is a confectionery company headquartered in Jamwon-dong, Seocho District, Seoul, South Korea. It was established in 1947. Its manufacturing is based in Jungnang District, Seoul and Anyang, Gyeonggi. It is historically an old popular biscuit brand beca...",1947.0,Seoul,,,
South Korea,Dongwon Industries,https://en.wikipedia.org/wiki/Dongwon_Industries,https://www.dwml.co.kr/eng,,Confirmed,"Dongwon Industries, Co., Ltd. (Korean: 동원산업주식회사) is a South Korean seafood company headquartered in Seoul, South Korea.",1969.0,"Seoul, and, Busan, South Korea",,,
South Korea,Doosan Corporation,https://en.wikipedia.org/wiki/Doosan_Corporation,http://www.doosan.com/en,,Confirmed,"Doosan Corporation (Korean: 주식회사 두산) is a corporate holding company headquartered in Euljiro 6-ga, Jung-gu, Seoul, South Korea.",1933.0,"Seoul, South Korea",,,
South Korea,Haitai,https://en.wikipedia.org/wiki/Haitai,http://www.ht.co.kr,,Confirmed,"Haitai (Korean: 해태) is a South Korean company based in Seoul. Its main businesses are retail and instant foods, especially confectionery, beverage and ice cream. The company was founded on October 3, 1945, and employs 3900 people at 8 plants in Cheonan, Anyang, Hayang, Gwangju, Cheongju, Munmak-eup,...",,,,,
South Korea,Hollys,https://en.wikipedia.org/wiki/Hollys,,,Manual Check Required,"KG Hollys F&B Co., Ltd, trading as Hollys (Korean: 할리스; RR: Halliseu) and known until March 2021 as Hollys Coffee (할리스 커피; Halliseu keopi), is a South Korean lifestyle and specialty coffee company part of the KG Group. The company was established in 1998 and opened South Korea's first espresso shop ...",1998.0,"Jung District, Seoul, South Korea","Coffee, baked goods",,
South Korea,Jeongin Food,https://en.wikipedia.org/wiki/Jeongin_Food,,http://www.jeong-in.co.kr,Potential,"Jeongin Food (Korean: 정인식품) is a South Korean company headquartered in Busan, South Korea. Established in 1998, the company is known to manufacture varieties of nurungji (누룽지); which is a traditional Korean food made of scorched rice.",,,,,
South Korea,Korea Tobacco & Ginseng Corporation,https://en.wikipedia.org/wiki/Korea_Tobacco_%26_Ginseng_Corporation,http://www.ktng.com/,,Confirmed,"KT&G Corporation (Korean: 주식회사 케이티앤지), originally Korea Tobacco & Ginseng, also branded as Korea Tomorrow & Global, is the leading tobacco company in South Korea with annual sales over US$4 billion. KT&G was originally a government-owned monopoly but was privatised and today is publicly traded, comp...",1989.0,"Daejeon, Chungnam, South Korea",Cigarettes,,USD 3.9 billion  (2018)
South Korea,Lotte CorporationLotte Wellfood,https://en.wikipedia.org/wiki/Lotte_Corporation,http://www.lotte.co.kr/global/en/main.do,,Confirmed,"Lotte Corporation (Korean: 롯데지주) is a South Korean multinational conglomerate corporation, and the fifth-largest chaebol in South Korea. Lotte was founded on 28 June 1948 by Korean businessman Shin Kyuk-ho in Tokyo. Shin expanded Lotte to his ancestral country, South Korea, with the establishment of...",1967.0,"Songpa District, Seoul, South Korea",,,
South Korea,Nongshim,https://en.wikipedia.org/wiki/Nongshim,http://eng.nongshim.com/,,Confirmed,"Nongshim Co., Ltd. (Korean: 농심) is a South Korean multinational food and beverage company headquartered in Seoul, South Korea. Nongshim was founded in 1965 under the name Lotte Food Industrial Company. The name was changed to Nongshim in 1978. The current logo was published in 1991, and is meant to ...",1965.0,"112 Yeouidaebang-ro, Dongjak-gu, Seoul, South Korea","Shin Ramyun, Shin Ramyun Black, Neoguri, Soon Noodle, Jjawang, Matchampong, Shrimp Crackers, Onion Rings, Baeksan Mountain Water",,"₩2,181.62 billion US$1.83 billion (2015)"
South Korea,Orion Confectionery,https://en.wikipedia.org/wiki/Orion_Confectionery,http://www.orionworld.com/en/,,Confirmed,"Orion Corporation (Korean: 주식회사 오리온) is a South Korean confectionery company, headquartered in Munbae-dong, Yongsan District, Seoul. The company is one of the three largest food companies in South Korea, and was established in 1956 as Tongyang Confectionery Corp. Orion has manufacturing facilities i...",,"Seoul, South Korea",,,
South Korea,Ottogi,https://en.wikipedia.org/wiki/Ottogi,http://www.ottogi.co.kr/,,Confirmed,"Ottogi Corporation (Korean: 오뚜기) is a food manufacturing company headquartered in Anyang, South Korea. Ottogi Center is located in Seoul and is listed on the KOSPI 200.",1969.0,"South Korea (Ottogi Center), Anyang, Gyeonggi, South Korea (HQ)","Curry, Instant food, Condiments, Instant noodle, Frozen food, Tea",,"KRW 2,739,036,859,209 ( FY 2021 )"
South Korea,Pulmuone,https://en.wikipedia.org/wiki/Pulmuone,http://www.pulmuone.co.kr/en/main/Index.do,,Confirmed,"Pulmuone Co., Ltd. (Korean: 풀무원) (KRX: 017810) is a South Korean company that produces plant-based foods such as tofu and soybean sprouts. It was founded in 1981, is based in Seoul, South Korea and sells its products both within Korea as well as internationally. The company provided major funding fo...",1981.0,"Seoul, South Korea",Plant-based foods,,
South Korea,Samyang Food,https://en.wikipedia.org/wiki/Samyang_Food,https://www.samyangfoods.com/,,Confirmed,"Samyang Roundsquare Co., Ltd. (Korean: 삼양라운드스퀘어) is an international South Korean food manufacturer and the first instant ramen company in South Korea. Samyang was founded on September 15, 1961, by Jeon Jung Yoon. In 1963, Samyang debuted the first Korean instant noodle.",1961.0,"Seoul, South Korea",,"1,754",US$ 1.2 billion (2024)
South Korea,Seoul Milk,https://en.wikipedia.org/wiki/Seoul_Milk,https://www.seoulmilk.co.kr/,,Confirmed,"Seoul Dairy Cooperative Ltd. (Korean: 서울우유협동조합; RR: Seoul-uyuhyeopdongjohap) is a food and dairy cooperative headquartered in Seoul, South Korea.",1937.0,"Seoul, South Korea","Milk, Cheese, Butter, Yogurt","1,800",KRW 13.8 billion (2024)
South Korea,SPC Group,https://en.wikipedia.org/wiki/SPC_Group,,http://www.spc.co.kr/spc/eng/main.spc,Potential,"SPC Group (Korean: 에스피씨 그룹) is a South Korean food company based in Seoul that manufactures food, bread, and other confectionery products. Sangmidang, the precursor of Samlip General Food was founded in 1945 and the group was launched in 2004. SPC Group is one of the oldest brands in the confectione...",1945.0,"Seoul, South Korea","Bread, ,, Confectionery, , Food Service",,₩ 6.7 trillion; US$ 5.7 billion (2020)
South Korea,Sulbing,https://en.wikipedia.org/wiki/Sulbing,http://www.sulbing.com/,,Confirmed,"Sulbing (Korean: 설빙), is a dessert cafe chain based in South Korea. As of 2014, the chain had over 490 retail stores in South Korea. It serves mainly various flavors of bingsu (Korean shaved ice).",2013.0,"Seoul, South Korea",,,
South Korea,Tory Food,https://en.wikipedia.org/wiki/Tory_Food,,http://www.toryfood.com,Potential,"Tory Food Co, Ltd. (Korean: 토리식품) is a Korean food company. Headquartered in Dongmak-ri, Gonggeom-myeon, Sangju, North Gyeongsang Province, it was established in 2001. It manufactures living food products and food under the brand Arirang Torirang (Korean: 아리랑 토리랑).",,,,,
South Korea,Yeolmae Food,https://en.wikipedia.org/wiki/Yeolmae_Food,,http://www.yeolmae.com,Potential,"Yeolmae Food (Korean: 열매식품) is a food company. Its headquarters are located in Gunpo Gyeonggi Province, Korea. Established in 1991, it manufactures many home food products. It has agency offices in Suwon, Gwangju, Busan, Daegu.",1991.0,"Gunpo, Gyeonggi Province, South Korea",,,
South Korea,CJ CheilJedang,https://en.wikipedia.org/wiki/CJ_CheilJedang,https://cj.co.kr/en,,Confirmed,"CJ CheilJedang Corporation (Korean: 씨제이제일제당) is a South Korean international food company based in Seoul that manufactures food ingredients, ambient, frozen and chilled packaged food products, pharmaceuticals and biotechnology. Its brands include Beksul, Bibigo, Gourmet and Hetbahn. Bibigo is well-k...",1953.0,"Jung-gu, Seoul","Food Ingredients, Pharmaceuticals and Biotechnology","5,991 (2013) non-consolidated in Korea",₩ 27.34 trillion (2025)
South Korea,Lotte Wellfood,https://en.wikipedia.org/wiki/Lotte_Wellfood,https://www.lotteconf.co.kr/en,,Confirmed,"Lotte Wellfood Co., Ltd. (Korean: 롯데웰푸드 주식회사), formerly Lotte Confectionery, is a South Korean international confectionery company headquartered in Seoul, South Korea. The company was established in 1967. Currently, it is the third-largest chewing gum manufacturer in the world, and its plants are lo...",1967.0,"Seoul, South Korea",,,
Spain,BEHER,https://en.wikipedia.org/wiki/BEHER_(ham),http://www.beher.com/es/,,Confirmed,"40°33′15″N 5°40′02″W﻿ / ﻿40.554259°N 5.667143°W﻿ / 40.554259; -5.667143 Beher (stylised as BEHER) and also called Bernardo Hernández, is a Spanish ham producer company that has worldwide fame. It is situated in the town of Guijuelo (province of Salamanca, Spain), in the Protected Designation of Orig...",1930.0,"Guijuelo, Spain","Jamón ibérico, and, Meat products",,€20 million
Spain,Borges Mediterranean Group,https://en.wikipedia.org/wiki/Borges_Mediterranean_Group,,http://www.borges.es,Potential,"Borges International Group (Catalan pronunciation: ) is a Spanish food company based in Tàrrega, Catalonia,Spain. It was founded in 1896. Borges produces a range of olive oil, nuts, dried fruits, olives, vinegars. The company exports products to over 120 countries and offers private-label production...",1896.0,"Tàrrega, Catalonia, Spain",Food,1100,670 million euros
Spain,Calidad Pascual,https://en.wikipedia.org/wiki/Calidad_Pascual,http://www.calidadpascual.com/,,Confirmed,"Calidad Pascual S.A.U. (formerly known as Grupo Leche Pascual) is a Spanish dairy company based in Madrid, Spain. The company was founded as Grupo Leche Pascual in 1969 by Tomás Pascual. It changed its name to Calidad Pascual (""Quality Pascual"") in January 2014.",1969.0,"Madrid, Spain",Dairy products,,980 millions €
Spain,Campofrío Food Group,https://en.wikipedia.org/wiki/Campofr%C3%ADo_Food_Group,http://www.campofriofoodgroup.com/,,Confirmed,"The Campofrío Food Group S.A.U. (Spanish: Grupo de Alimentación Campofrío), formerly Conservera Campofrío S.A., simply known as Campofrío, is a prominent Spanish multinational food company based in Alcobendas, Spain. The company produces different kinds of processed meat products. The company was fo...",1952.0,"Alcobendas, Community of Madrid, Spain","Deli meat, , ethnic foods, pantry foods","19,700 (2013)",€ 1.630 billion (2010)
Spain,Ebro Foods,https://en.wikipedia.org/wiki/Ebro_Foods,http://www.ebrofoods.es/en/,,Confirmed,"Ebro Foods, S.A. (/ˈiːbroʊ fuːdz/; Spanish: ), formerly Ebro Puleva, is a Spanish food processing company. Ebro Foods is the world's largest producer of rice and the second biggest producer of pasta (its Panzani brand is a market leader in France). The company's head office is in Madrid.",1998.0,"Madrid, Spain","Rice, ,, pasta, and, sauces, ,, food technology","7,834 (2020)",€2.897 billion (2020)
Spain,Galletas Gullón,https://en.wikipedia.org/wiki/Galletas_Gull%C3%B3n,,http://www.gullon.es/en/,Potential,"Galletas Gullón (English: Gullón Biscuits) is a Spanish food sector company dedicated to the manufacture of crackers and biscuits. Founded in 1892, in Aguilar de Campoo in the province of Palencia surrounded by wheat fields, Gullón has been the leading producer of biscuits in Spain. In 2009, it had ...",1892.0,"(, Palencia, ), Spain","Biscuits, Cookies, Crackers",,
Spain,Grupo Calvo,https://en.wikipedia.org/wiki/Grupo_Calvo,,https://www.grupocalvo.com,Potential,"The Calvo Group is a backward vertically integrated group of companies dedicated to fishing, processing and distribution of canned goods. The group is centred on Luis Calvo Sanz, S.A., a company established in 1940 in Carballo. Grupo Calvo operated in the town of Guanta, Venezuela under the name ""At...",1940.0,"Carballo, Spain",,"5,200",€ 426.72 million (2009)
Spain,Kalise Menorquina,https://en.wikipedia.org/wiki/Kalise_Menorquina,http://kalise.com/,,Confirmed,"Kalise is a Spanish ice cream and dessert manufacturing company, established in 1960 and based on Las Palmas de Gran Canaria in the Canary Islands. The company was part of the ""Grupo Kalise–La Menorquina S.A."", after merging with another ice cream company of Spain, La Menorquina. During that partner...",1960.0,"Las Palmas, Spain","Ice creams, , Frozen desserts,, yogurts",,
Spain,Mahou-San Miguel Group,https://en.wikipedia.org/wiki/Mahou-San_Miguel_Group,,https://www.mahou-sanmiguel.com/,Potential,"Mahou San Miguel is a Spanish brewery, founded in Madrid in 1890 under the name of Hijos de Casimiro Mahou, fábrica de hielo y cerveza (English: The Sons of Casimiro Mahou, production of ice and beer). Mahou San Miguel is the leading brand in the Spanish beer market.",1890.0,"Madrid, Spain",Beers,,
Spain,Nutrexpa,https://en.wikipedia.org/wiki/Nutrexpa,,https://web.archive.org/web/20070116064511/http://www.nutrexpa.es/,Potential,"Idilia Foods (formerly Nutrexpa) is a Spanish food business group. The company is headquartered in Barcelona and was established in 1940. It produces food items such as fish stock cubes, baker's yeast, caramel or honey. Some major brands of the company are:",1940.0,"Valencia, Spain",,350 (2023),"194,000,000 euro (2023)"
Spain,Pescanova,https://en.wikipedia.org/wiki/Pescanova,,http://www.pescanova.com,Potential,"Nueva Pescanova (previously Pescanova, S.A.) is a Spanish seafood company based in Redondela, Galicia. The group operates in 17 countries with approximately 12,400 employees.",1960.0,"Redondela, Spain","Fresh Fish, Frozen Fish, Value-added Fish products, Fish meals, Frozen food","7,700 (3,399 in Spain)",€ 1.49 billion (2009)
Spain,Quely,https://en.wikipedia.org/wiki/Quely,,http://www.quely.com/en,Potential,"Quely is a family-run company founded in Majorca, Spain, in 1853, that manufactures biscuits, baked goods, and chocolate-coated products.",1853.0,"Inca, Majorca, Spain","Biscuits, baked goods, chocolate-coated products",,
Spain,San Nicasio,https://en.wikipedia.org/wiki/San_Nicasio,http://www.sannicasio.es/ENG/index.html,,Confirmed,"San Nicasio is a Spanish brand of gourmet potato chips, established in 1999. The slow cooked chips have won a number of food industry awards for quality and have received a level of notoriety due to the high price tag of the product.",1999.0,"Priego de Córdoba, Province of Córdoba, Spain",Potato chips,,
Spain,Ta-Tung,https://en.wikipedia.org/wiki/Ta-Tung,http://www.ta-tung.com/,,Confirmed,"Ta-Tung is a food company based in L'Hospitalet de Llobregat, Catalonia, Spain. The company was founded in 1980 by Ly Kav, a Cambodian who arrived in Barcelona in 1979. The company makes precooked Asian cuisine, and is the leading producer of such food in Spain. In addition to Spain, Ta-Tung also ex...",1980.0,"Sant Vicenç dels Horts, Catalonia, Spain",,,
Sri Lanka,Cargills (Ceylon) PLC,https://en.wikipedia.org/wiki/Cargills_(Ceylon)_PLC,http://www.cargillsceylon.com,,Confirmed,"Cargills (Ceylon) PLC is a Sri Lankan consumer company listed on the Colombo Stock Exchange. It primarily operates in the modern retail (supermarkets), FMCG, and restaurant industries, and is also involved in banking, real estate, agriculture and cinema operations. Cargills is among the top listed c...",1844.0,"No. 40, York Street Colombo 01, Colombo, Sri Lanka","FMCG, Brands, Magic, Kotmale, Kist, Goldi, Knuckles, RIDE, Sara's, Retail, Brands, Cargills Food City, Restaurants, Brands, KFC, Sri Lanka","11,300+ (2026)",LKR 273 billion (2026)
Sri Lanka,Ceylon Biscuits Limited,https://en.wikipedia.org/wiki/Ceylon_Biscuits_Limited,,,Manual Check Required,"Ceylon Biscuits Limited (branded CBL, commonly called Munchee) is a Sri Lankan food manufacturer, the maker of Munchee biscuits and one of the oldest biscuit makers in Sri Lanka. The company owns 60% of the domestic market share in Sri Lanka.",1939.0,"Pannipitiya, Colombo, Sri Lanka","Biscuits, Chocolate, Cakes, Jelly, Snacks, Soy based products, Cereal products, Organic products, Soups",286 (2018),Rs. 1.996 billion (2018)
Sri Lanka,Ceylon Cold Stores,https://en.wikipedia.org/wiki/Ceylon_Cold_Stores,,,Manual Check Required,"Ceylon Cold Stores (CCS), trading as Elephant House, is a Sri Lankan company which produces carbonated drinks, ice cream and processed meat products. Despite competition from global competitors such as Coca-Cola and Pepsi, Elephant Soft Drinks remains the market leader in Sri Lanka.",1866.0,"Colombo, Sri Lanka","Beverages, Frozen confectionery, Processed meats","7,568 (2023)",LKR 126.149 billion (2023)
Sri Lanka,Daintee,https://en.wikipedia.org/wiki/Daintee,,,Manual Check Required,Daintee is a company based in Sri Lanka that produces confectionery and other food products. It is the market leader in confectionery sales in Sri Lanka.,1984.0,"72C, Kandawala Road, Ratmalana, Sri Lanka",,,$5.6 million
Sri Lanka,Harischandra Mills,https://en.wikipedia.org/wiki/Harischandra_Mills,https://harischandramills.com/,,Confirmed,Harischandra Mills PLC is a food processing company in Sri Lanka.,1953.0,"Matara, Sri Lanka",,643 (2022),"LKR 4,581 million (2022)"
Sri Lanka,Maliban Biscuit Manufactories Limited,https://en.wikipedia.org/wiki/Maliban_Biscuit_Manufactories_Limited,,,Manual Check Required,"Maliban Biscuit Manufactories, is one of the largest manufacturers, distributors and marketers of bakery products in Sri Lanka. Maliban is a privately owned limited liability company.",1954.0,"Ratmalana, Colombo, Sri Lanka",,,
Sri Lanka,Pelwatte Sugar Industries PLC,https://en.wikipedia.org/wiki/Pelwatte_Sugar_Industries_PLC,,,Manual Check Required,"Pelwatte Sugar Industries PLC is a Sri Lankan sugar manufacturing company, which is listed on the Colombo Stock Exchange. The main sugar factory of the group is located in Buttala in the Moneragala District, Uva Province, about 225 kilometres (140 mi) from Colombo to the east of the country. Pelwatt...",1981.0,"Buttala, Sri Lanka","Sugar, Dairy, Alcohol","5,100 (2019)",Rs 42 billion (2019)
Sweden,AarhusKarlshamn,https://en.wikipedia.org/wiki/AarhusKarlshamn,http://www.aak.com/,,Confirmed,"AAK AB, formerly AarhusKarlshamn, is a global Sweden-based company and producer of vegetable oils and fats.",2005.0,"Malmö, Sweden",,"4,013 (2021)","SEK 35,452 million (2021)"
Sweden,Abba Seafood,https://en.wikipedia.org/wiki/Abba_Seafood,https://www.abba.se/,,Confirmed,"Abba Seafood AB, formerly Abba AB, with head offices in Gothenburg, Sweden, is a company producing preserved fish products. The main factory is located in Kungshamn. The company was established in Bergen 1838 and in the 1850s it moved to Stockholm. The name Aktiebolaget Bröderna Ameln, Abba, was reg...",1838.0,"Gothenburg, Sweden",,about 391 (2012),SEK 1.266 billion (2011)
Sweden,Arla Foods,https://en.wikipedia.org/wiki/Arla_Foods,http://arla.com,,Confirmed,"Arla Foods is a Danish/Swedish multinational co-operative based in Viby, Denmark. It is the fifth biggest dairy company in the world and the largest producer of dairy products in Scandinavia and the United Kingdom. Arla Foods was formed as the result of a merger between the Swedish dairy co-operativ...",2000.0,"Viby, Denmark",,"20,907 (2022)",13.8 billion EUR (2022)
Sweden,Cloetta,https://en.wikipedia.org/wiki/Cloetta,http://www.cloetta.com,,Confirmed,"Cloetta is a Swedish confectionery company. The company manufactures and sells local confectionery brands on its main markets Sweden, Finland, Norway, Denmark, Netherlands, Germany and the UK.",1862.0,"Sundbyberg, Stockholm County, Sweden","Confectionery, ,, Nuts","2,600 (December 2024)",SEK 8.6 billion (2024)
Sweden,Findus,https://en.wikipedia.org/wiki/Findus,http://www.findus.com,,Confirmed,"Findus (/ˈfɪndəs/; Swedish: ) is a frozen food brand which was first sold in Sweden in 1945. Findus products include ready meals, peas and Crispy Pancakes, the latter of which were invented in the early 1970s. The Swiss food company Nestlé owned the Findus brand from 1962 to 2000; it sold the rights...",,,,,
Sweden,Gunnar Dafgård,https://en.wikipedia.org/wiki/Gunnar_Dafg%C3%A5rd_AB,,,Manual Check Required,Gunnar Dafgård AB (GDAB) was founded 1937 by Gunnar Dafgård and is Sweden's largest private food producer with an annual revenue of more than US$300 million. GDAB has customers throughout Europe with the main market being Scandinavia. GDAB produces all kinds of foods but the biggest selling products...,,,,,
Sweden,Lantmännen,https://en.wikipedia.org/wiki/Lantm%C3%A4nnen,,https://www.lantmannen.com/,Potential,"Lantmännen (Swedish for 'farmers', literally 'land/rural men') is a Swedish agricultural cooperative. Owned by 19,000 Swedish farmers, they have 10,000 employees, operations in over 20 countries and an annual turnover of SEK 18 billion (approximately EUR 6.2 billion). The cooperative owns several fo...",2001.0,"Stockholm, Sweden",,~10 000,~18 billion SEK (2024)
Sweden,Mackmyra Whisky,https://en.wikipedia.org/wiki/Mackmyra_Whisky,http://mackmyra.com/?accept=yes,,Confirmed,"Mackmyra Whiskyis a Swedish Single malt whisky distillery. On 19 August 2024, Mackmyra Svensk Whisky AB filed for bankruptcy. After the bankruptcy, more than 50 organizations expressed interest to buy Mackmyra, such interest level is unprecedented in Swedish history. It is named after the village an...",1998.0,,Distilled and blended liquors,53 (2013),SEK 64.302 million million  (2013)
Sweden,Norrmejerier,https://en.wikipedia.org/wiki/Norrmejerier,,http://www.norrmejerier.se/,Potential,"Norrmejerier is a Swedish dairy company. Norrmejerier was formed in 1971 when the Västerbottens Södra Mejeriförening, Skellefteortens mejeriförening and Lappmarkens mejeriförening were combined. Norrbottens läns producentförening was incorporated in 1992. Norrmejerier is the sole producer of Västerb...",1971.0,"Umeå, Sweden",,490 (2005),SEK 1.5 billion (2005)
Sweden,Pågen,https://en.wikipedia.org/wiki/P%C3%A5gen,http://www.pagen.com/,,Confirmed,"Pågen is a Swedish bakery company founded in 1878 by Anders and Matilda Påhlsson. The company started off as a small bakery in Malmö, in the southern province of Scania. Their bakeries are run by around 1350 employees, and are located in Malmö and Gothenburg. Their products include brands such as Kr...",,,,,
Sweden,Polarbröd,https://en.wikipedia.org/wiki/Polarbr%C3%B6d,,http://di.se/Nyheter/?page=%2fAvdelningar%2fArtikel.aspx%3fO%3dIndex%26ArticleId%3d2006%5c01%5c25%5c173052%26src%3ddi,Potential,"Polarbröd is a Swedish bread company. Their head office is in Älvsbyn in northern Sweden. Polarbröd is Sweden's third-largest bread company. Its typical product is a soft compact bread formed into round, flat shapes. It is also noted for ready-made sandwiches produced from such bread and reindeer me...",1971.0,"Älvsbyn, Sweden",,,
